name,description,category,subcategory,link,location,Oferta_Demanda,Price,Kms/Type_vehicle,Other_skills
,,,,,,,,,
nosotros te compramos tu coche embargado,"Compró todo tipo de vehículos, nuevos 0km, de alta gama, lotes ,embargados con cargas financieras reserva de dominio leasing quiebra de empresa con o sin itv, con precinto pagamos en el acto somos compradores y exportadores directos sin intermediarios nos dedicamos a la exportación de coches con todo tipo de cargas o impagos Maxima tasación nos desplazamos en todo territorio español…..",coches de segunda mano,coches de segunda mano en ourense,https://www.milanuncios.com/coches-de-segunda-mano/nosotros-te-compramos-tu-coche-embargado-429523585.htm,Ourense / Orense,DEMANDA,,,
opel insignia,Perfecto estado. Motor 2.0cdti. Recién revisado y con la ITV al día. Caja de cambio automática nueva de fábrica.,opel de segunda mano,opel de segunda mano en las_palmas,https://www.milanuncios.com/opel-de-segunda-mano/opel-insignia-411992098.htm,Las Palmas de Gran Canaria,OFERTA,6.495 €,170.000 kms,
serrano los trabajos profesionales,serrano tiene ofertas para Mudanzas,mudanzas,mudanzas en santiago de compostela a_coruna,https://www.milanuncios.com/mudanzas/serrano-los-trabajos-profesionales-429551728.htm,Santiago de Compostela,OFERTA,,,
reformas,"Reformamos tu vivienda,local,comunidad.... Todos los gremios. Presupuestos sin compromiso. Albañilería, fontanería, electricidad, fontanería, pintura, carpintería.... Tejados, fachadas.... Impermehabilizacion de terrazas,tejados....",reformas,reformas en zaragoza zaragoza,https://www.milanuncios.com/reformas/reformas-427875896.htm,Zaragoza,OFERTA,,,
compro vehiculos con embargo precinto et,Compro coches financiados con embargo leasing precinto para exportacion export todas las marcas mercedes benz bmw audi peugeot fiat ford seat renault skoda citroen cupra hyundai kia land rover dacia maserati mini porsche toyota volkswagen volvo nissan opel tesla mitsubishi mazda lexux jeep jaguar etc y todos los modelos maxima tasacion pago en el acto dinero efectivo o por transferencia bankaria me desplazo por toda espaÑa no dude en contactar con mingo para vender su coche con reserva de domenio embargo precinto leasing sin papeles km0 etc...,coches de segunda mano,coches de segunda mano en barcelona,https://www.milanuncios.com/coches-de-segunda-mano/compro-vehiculos-con-embargo-precinto-et-422681702.htm,Badalona,DEMANDA,8.400 €,Automático,
clase particulares oposicion cnp,"Antes de estar aquí, yo también era opositor y me he dejado mucho dinero tanto en academias que no iban a ningún lado, como profesores que me leían el temario sin dar explicaciones, así como temarios en los que solo les interesa ser más extensos sin ningún fundamento. Por eso mi planificación se basa en sacar el apto en el examen y enseñarte a estudiar una oposición que eso nadie te lo enseña. No te voy a enseñar a ser jurista ni nada por el estilo solo a saber contestar para aprobar. Si lo que quieres es buscar ese apto vente y prueba un día por ti mismo sin compromiso ninguno siendo la primera clase gratis. Whatsha 692190074 cualquier duda",oposiciones,oposiciones en alcorcon madrid,https://www.milanuncios.com/oposiciones/clase-particulares-oposicion-cnp-415905768.htm,Alcorcón,OFERTA,15 €,,
tu apartamento en burgos nuevo,"**** en el ático de nuestra casa, tienes este bonito apartamento, cómodo y con todos los detalles. toda la info en : www.alojarte.es . lo puedes alquilar por semanas (desde 190€) o meses (450€ a 650€) en el precio, los gastos y el desayuno pueden estar incluidos y te daremos todo tipo de información y facilidades para asegurarte una estancia muy agradable. se encuentra en burgos (quintanadueñas) a 12 minutos del centro en coche y a 5 del polígono de villalonquejar, con facilidad para el aparcamiento, en la misma puerta y la tranquilidad del campo, que puedes ver desde la ventana, los pájaros también te saludarán por la mañana. puedes guardar tu bici o moto en nuestro garaje cerrado. con capacidad para 4 personas, 1 cama matrimonio en habitación y otra de 135 en el salón, baño completo y cocina americana. servicios: tv, wifi, equipo de música, calefacción, ropa de cama y toallas, secador de pelo, vitrocerámica, microondas, frigorífico, lavadora. no se permiten fiestas ni eventos. no se admiten mascotas. no está permitido fumar. visita nuestra web: www.alojarte.es",alquiler vacaciones en quintanaduenas burgos,alquiler vacaciones en quintanaduenas burgos,https://www.milanuncios.com/alquiler-vacaciones-en-quintanaduenas-burgos/tu-apartamento-en-burgos-nuevo-249533985.htm,Quintanadueñas,OFERTA,450 €,1 dorm.,
remolque doble eje basculante,"Hidraulico basculante FR industrial basculante reforzado 2 ejes con bomba hidraulica, opcional a electrica, provisto con freno de inercia a las 4 ruedas, 2 ejes de 1000 kg, opcionales a 1500 kg. Medidas de caja estándar 2200x1280+700 (largo, ancho y altura) puerta trasera tipo portón abatible, en rampa y desmontable. Lanza doble reforzada, Ruedas 155x80x13 mas repuesto, opcionales a 14 pulgadas y rueda de todo terreno 4x4, instalación eléctrica y papeles y documentación en regla. ganchos para lona, imprimación de alta resistencia anticorrosión y pintura al horno acabado en brillante. Numero 1 en ventas. Alta calidad, fabricando desde 1976. garantía. Entrega inmediata. Fabrica de Remolques y Caravanas.",remolques,remolques en ciudad real ciudad_real,https://www.milanuncios.com/remolques/remolque-doble-eje-basculante-427900982.htm,Ciudad Real,OFERTA,2.100 €,,
reformas y pinturas,"Hacemos todo tipo de pinturas,papel pintado,pladur,tarima flotante o Reformas en General. Comunidad de Madrid Presupuesto sin compromiso! Tel.634122551 Miguel.",construccion,construccion en madrid madrid,https://www.milanuncios.com/construccion/reformas-y-pinturas-397734757.htm,Madrid,DEMANDA,,,
centro santo tomas 5 segovia,"local comercial en alquiler. Amplio escaparate. Planta calle, zona consolidada comercialmente hablando, con mucho transito peatonal y rodado. Se encuentra en la calle Santo Tomas, frente a un nuevo proyecto de viviendas y a pocos metros del ambulatorio. Muy buen estado, cierres metalicos de seguridad automáticos. Acondicionador calor/frio, pequeño despacho, aseo y probador. Dos plantas. Certificación energética : (304 kwh/m3 año ) Mejor verlo. Se admite negociación.",alquiler de locales comerciales en segovia segovia,alquiler de locales comerciales en segovia segovia,https://www.milanuncios.com/alquiler-de-locales-comerciales-en-segovia-segovia/centro-santo-tomas-5-segovia-365557334.htm,Segovia,OFERTA,1.000 €,75 m²,
honda shadow vt600,"Honda shadow vt 600 del 92 ,muy cuidada,un solo dueño,customizada con muchos extras,se entrega piezas originales;ruedas nuevas,reglaje de válvulas,retenes y aceite de suspensión nuevos,etc….comunicar por whatsapp.",motos clasicas,motos clasicas en illescas toledo,https://www.milanuncios.com/motos-clasicas/honda-shadow-vt600-427857879.htm,Illescas,OFERTA,3.200 €,49.000 kms,
energica ego,"El corazón verde de la moto eléctrica Ego es un motor síncrono de imanes permanentes refrigerado por aceite, que desarrolla una potencia de 107kW (145 CV aprox.) entre 4.900 y 10.500 rpm, y un par motor de 200 Nm de 0 rpm a 4.700 rpm. La moto eléctrica Energica Ego acelera de 0 a 100 km/h en 2.9 segundos y una velocidad máxima de 240 km/h con un empuje tan impresionante que no se echan en falta las caídas de revoluciones del motor típicas de los continuos cambios de marcha de los motores endotérmicos, y que hacen que sea más rápida que una 600 supersport.",motos de carretera,motos de carretera en palma de mallorca baleares,https://www.milanuncios.com/motos-de-carretera/energica-ego-429359421.htm,Palma de Mallorca,OFERTA,18.900 €,4.877 kms,
marinbr63,Barco con motor Yamaha 150 Hp de cuatro tiempos. Su número de teléfono si está interesado. Gracias,barcos a motor,barcos a motor en carretera vieja de valencia tarragona,https://www.milanuncios.com/barcos-a-motor/marinbr63-429769460.htm,Carretera Vieja de Valencia,OFERTA,9.000 €,2013,
carretera chinchon titulcia,"Parcela en el término de Chinchón, tiene una edificación en ruinas, terreno de cerro que linda con el río Tajuña y tiene torreta eléctrica dentro de la finca, linda con dos caminos para entrar desde la carretera de Madrid o por la de Titulcia, urge. Tierra, terreno, parcela, finca. Ideal para plantación de almendro, pistacho, forestación ( la comunidad de Madrid da subvenciones para forestación) la parcela tiene 104000m2 pero no me deja ponerlo, 636 2095 74",venta de fincas en chinchon madrid,venta de fincas en chinchon madrid,https://www.milanuncios.com/venta-de-fincas-en-chinchon-madrid/carretera-chinchon-titulcia-423243709.htm,Chinchon,OFERTA,65.000 €,99999 m²,
obrero frigorista industrial,"Empresa del sector de la construcción con más de 10 años de experiencia necesita la incorporación de una persona que tenga experiencia demostrable de varios años en Mantenimiento, Albañileria, Pintura, Carpinteria, Electricidad, Fontaneria, Aire Acondicionado... pero sobre todo sea especialista como Frigorista Industrial. Incorporación Inmediata, requisito tener vehículo propio para desplazarse al lugar de trabajo. Abstenerse personas que no cumplen los requisitos, no reunen la experiencia necesaria, no tienen papeles o no tienen un interés real. Enviar CV al Whattsapp del anuncio.",construccion,construccion,https://www.milanuncios.com/construccion/obrero-frigorista-industrial-401890167.htm,Nules,OFERTA,,,
portes y mudanzas desde 20,"Portes baratos, mudanzas, transportes todos los dias. domingos y festivos tambien. llámanos o whatsupp en toda la comunidad de madrid y toda la peninsula. precios economicos, los más baratos. servicio de guardamuebles economico para guardar tus cosas sin que te duela el bolsillo. tambien montajes de muebles, desmontajes, embalajes. transportamos motos, quads,lavadoras, sofas, armarios, camas. recogidas en leroy merlin, ikea, bauhaus, grandes almacenes, empresas de trasteros y guardamuebles. vaciado de locales, desescombro...etc.porte, mudanza madrid, alcobendas, alcorcon, mostoles, getafe, fuenlabrada, leganes, torrejon, humanes, parla, pinto, alcala, cercedilla, torrelodones,valdemoro, villalba, coslada, tres cantos, colmenar, san martin, talavera. . .",transportistas,transportistas,https://www.milanuncios.com/transportistas/portes-y-mudanzas-desde-20-321373036.htm,Madrid,DEMANDA,,,
portes y mudanzas las palmas,"SE REALIZAN TRANSPORTES, MUDANZAS, RETIRADA DE MUEBLES, RETIRADA DE ESCOMBROS, RETIRADA DE MATERIALES DE BRICOMART, LEROY MERLIN , ETC PARA MAS INFORMACIÓN CONTACTAR POR PRIVADO. PRESUPUESTO SIN COMPROMISO y al instante PRECIOS ECONÓMICOS ¡LLAMANOS",mudanzas,mudanzas en las palmas de gran canaria las_palmas,https://www.milanuncios.com/mudanzas/portes-y-mudanzas-las-palmas-429720835.htm,Las Palmas de Gran Canaria,OFERTA,,,
compro tu coche para exportacion,Compro vehículos embargados con reserva de domenio financiados intransferibles coches con cargas impuestos atrasados… pago engel acto!! i nos encargamos de todo el paleo somos profesionales tenemos más de 20 años de experiencia en el mundo del motor…! te te pagamos mÁs que nadie te pagamos en efectivo o mediante transferencia como te venga mÁs cÓmodo no dudes en llamarnos disponibles las 24 horas del día dbs,otros coches de segunda mano,otros coches de segunda mano en madrid,https://www.milanuncios.com/otros-coches-de-segunda-mano/compro-tu-coche-para-exportacion-422312116.htm,Madrid,DEMANDA,10.000 €,Automático,
desatascos profesionales,"Urgencias de desatascos , disponemos de camaras de t.v , cubas y bombas para extracciones , localizadores de arquetas , caÑerias y bajantes , localizadores de arquetas , los mejores en el mercado , numero uno en desatascos .",fontaneros,fontaneros en santa cruz de tenerife tenerife,https://www.milanuncios.com/fontaneros/desatascos-profesionales-201733088.htm,Santa Cruz de Tenerife,OFERTA,,,
daf cf 440 ft,Camión en muy buen estado cambio manual ruedas todas Hankoon nuevas recién puestas toma de fuerza para bañera,camiones usados,camiones usados en azucaica toledo,https://www.milanuncios.com/camiones-usados/daf-cf-440-ft-417225626.htm,Azucaica,OFERTA,28.000 €,444.150 kms,
les corts cardenal reig 18,ALQUILER SIN TRASPASO!!! Restaurante C3 Se alquila un restaurante totalmente equipado con licencia C3 Terraza de 6 mesas y 24 personas Alquiler mensual 3.000 euros Fianza 3 meses,traspasos de restaurantes en barcelona barcelona,traspasos de restaurantes en barcelona barcelona,https://www.milanuncios.com/traspasos-de-restaurantes-en-barcelona-barcelona/les-corts-cardenal-reig-18-421601993.htm,Barcelona,OFERTA,3.000 €,130 m²,
abrigo de vison nuevo,Hasta media pierna Sin estrenar,otros moda mujer,otros moda mujer en altafulla tarragona,https://www.milanuncios.com/otros-moda-mujer/abrigo-de-vison-nuevo-418668230.htm,Altafulla,OFERTA,1.000 €,,
5 euros x mordida de chica en mi brazo,"Daniel Piñuel, 22 años y fetichista en playa muchavista de el Campello, Alicante Pago 5€ a cada chica (solo chicas) que me muerda lo más fuerte que ella pueda en el centro de mis antebrazos superiores, mayor de 16 si es posible se paga justo después de morderme, es más, el dinero lo tendríamos las dos partes a la vista en el momento del mordisco pago 1-2€ por chica si hubiera una persona intermediaria que consiga 2 o mas chicas, se pagaría dicha cantidad quedando más tarde  o el día después de la mordida Cualquier interés o duda por wasap no llamada 601279249",oportunidades de negocio,oportunidades de negocio en fabraquer (ayuntamiento campello) alicante,https://www.milanuncios.com/oportunidades-de-negocio/5-euros-x-mordida-de-chica-en-mi-brazo-429921162.htm,Fabraquer (Ayuntamiento Campello),OFERTA,,,
espectacular camada de border collie,"Espectacular camada de Border collie de Pura raza ,criados en plena montaña en el prepirineo catalan .MADRE blanca /negra, PADRE lilac con pedigree .estan criados en ambiente familiar acostumbrados a niños y gato. Pues venir a verlos cuando quieras .Solo para familias que quieran un cachorro estable emocionalmente ya que estos pequeños estan criados con sus padres.",border collie,border collie en lluca barcelona,https://www.milanuncios.com/border-collie/espectacular-camada-de-border-collie-429758718.htm,Lluça,OFERTA,400 €,,